{
  "fixture_version": "1",
  "case_id": "human-show-20",
  "normative_rule_ids": [
    "M0-SHOW-001",
    "M0-SHOW-003",
    "M0-SHOW-004",
    "M0-SHOW-005"
  ],
  "applicable_platform_profiles": [
    "controlled-test"
  ],
  "initial_tree": [
    {
      "path": ".case-agent/dossiers/case-dossier-1/decisions/.keep",
      "content_file": "data/empty.bin",
      "sha256": "sha256:e3b0c44298fc1c149afbf4c8996fb92427ae41e4649b934ca495991b7852b855"
    },
    {
      "path": ".case-agent/dossiers/case-dossier-1/dossier.json",
      "content_file": "data/human-show-20-dossier.json",
      "sha256": "sha256:07fb78c45840af3e39355a98b4289d65fb94365bb4e22971e5659ad1719d9e46"
    },
    {
      "path": ".case-agent/dossiers/case-dossier-1/handoffs/.keep",
      "content_file": "data/empty.bin",
      "sha256": "sha256:e3b0c44298fc1c149afbf4c8996fb92427ae41e4649b934ca495991b7852b855"
    },
    {
      "path": ".case-agent/dossiers/case-dossier-1/submissions/.keep",
      "content_file": "data/empty.bin",
      "sha256": "sha256:e3b0c44298fc1c149afbf4c8996fb92427ae41e4649b934ca495991b7852b855"
    },
    {
      "path": ".case-agent/locks/.keep",
      "content_file": "data/empty.bin",
      "sha256": "sha256:e3b0c44298fc1c149afbf4c8996fb92427ae41e4649b934ca495991b7852b855"
    },
    {
      "path": ".case-agent/manifest.json",
      "content_file": "data/manifest.json",
      "sha256": "sha256:66f56e2f32be3eca6721a2cc533045ba637151770bcecd84b938aef76f96ba45"
    }
  ],
  "invocations": [
    {
      "actor_label": "trace-main",
      "argv": [
        "dossier",
        "show",
        "--dossier",
        "case-dossier-1"
      ],
      "stdin_mode": "none",
      "stdin_content_file": null,
      "fixed_environment": {
        "CASE_CLOCK": "2026-09-04T03:02:01Z",
        "CASE_ID_SEED": "case",
        "CASE_PROCESS_PROFILE": "controlled-test",
        "CASE_PROCESS_PID": "1001",
        "CASE_PROCESS_STARTED_AT": "2026-09-04T03:00:00Z",
        "CASE_PROCESS_STATUS": "terminated",
        "CASE_NETWORK": "deny",
        "LANG": "C",
        "LC_ALL": "C",
        "TZ": "UTC"
      },
      "concurrency_group": null,
      "fault_point": null
    }
  ],
  "expected": [
    {
      "process_exit": 0,
      "result_code": "CASE_OK",
      "stdout_json_file": "data/expected/generated/human-show-20.txt",
      "stderr": "empty",
      "stderr_file": null
    }
  ],
  "expected_final_tree": [
    {
      "path": ".case-agent/dossiers/case-dossier-1/decisions/.keep",
      "presence": "present",
      "sha256": "sha256:e3b0c44298fc1c149afbf4c8996fb92427ae41e4649b934ca495991b7852b855"
    },
    {
      "path": ".case-agent/dossiers/case-dossier-1/dossier.json",
      "presence": "present",
      "sha256": "sha256:07fb78c45840af3e39355a98b4289d65fb94365bb4e22971e5659ad1719d9e46"
    },
    {
      "path": ".case-agent/dossiers/case-dossier-1/handoffs/.keep",
      "presence": "present",
      "sha256": "sha256:e3b0c44298fc1c149afbf4c8996fb92427ae41e4649b934ca495991b7852b855"
    },
    {
      "path": ".case-agent/dossiers/case-dossier-1/submissions/.keep",
      "presence": "present",
      "sha256": "sha256:e3b0c44298fc1c149afbf4c8996fb92427ae41e4649b934ca495991b7852b855"
    },
    {
      "path": ".case-agent/locks/.keep",
      "presence": "present",
      "sha256": "sha256:e3b0c44298fc1c149afbf4c8996fb92427ae41e4649b934ca495991b7852b855"
    },
    {
      "path": ".case-agent/manifest.json",
      "presence": "present",
      "sha256": "sha256:66f56e2f32be3eca6721a2cc533045ba637151770bcecd84b938aef76f96ba45"
    }
  ],
  "expected_derived_view_file": null
}
