{
  "fixture_version": "1",
  "case_id": "retry-immediate",
  "normative_rule_ids": [
    "M0-CLI-007",
    "M0-CORPUS-005",
    "M0-MUTATION-005",
    "M0-SCALAR-009"
  ],
  "applicable_platform_profiles": [
    "controlled-test"
  ],
  "initial_tree": [
    {
      "path": ".case-agent/dossiers/case-dossier-1/decisions/.keep",
      "content_file": "data/empty.bin",
      "sha256": "sha256:e3b0c44298fc1c149afbf4c8996fb92427ae41e4649b934ca495991b7852b855"
    },
    {
      "path": ".case-agent/dossiers/case-dossier-1/dossier.json",
      "content_file": "data/base-dossier.json",
      "sha256": "sha256:95c75dce56bc78d3db8c532acba516a20b8b692085a5e1b1183be0f5214eb44e"
    },
    {
      "path": ".case-agent/dossiers/case-dossier-1/handoffs/.keep",
      "content_file": "data/empty.bin",
      "sha256": "sha256:e3b0c44298fc1c149afbf4c8996fb92427ae41e4649b934ca495991b7852b855"
    },
    {
      "path": ".case-agent/dossiers/case-dossier-1/submissions/.keep",
      "content_file": "data/empty.bin",
      "sha256": "sha256:e3b0c44298fc1c149afbf4c8996fb92427ae41e4649b934ca495991b7852b855"
    },
    {
      "path": ".case-agent/locks/.keep",
      "content_file": "data/empty.bin",
      "sha256": "sha256:e3b0c44298fc1c149afbf4c8996fb92427ae41e4649b934ca495991b7852b855"
    },
    {
      "path": ".case-agent/manifest.json",
      "content_file": "data/manifest.json",
      "sha256": "sha256:66f56e2f32be3eca6721a2cc533045ba637151770bcecd84b938aef76f96ba45"
    },
    {
      "path": "artifact.txt",
      "content_file": "data/artifact-v1.txt",
      "sha256": "sha256:2d27fbdf4e8ca207afbfa388ca9172fbcc6c70e534af2476b3b704f87debadcf"
    }
  ],
  "invocations": [
    {
      "actor_label": "trace-main",
      "argv": [
        "--json",
        "evidence",
        "add",
        "--dossier",
        "case-dossier-1",
        "--operation",
        "op-retry",
        "--run",
        "case-run-1",
        "--expected-revision",
        "0",
        "--expected-state-digest",
        "sha256:c8fdd08bc12368f98d3aaa736d1bc1057d07ea18aba6b549a6039021205c175d",
        "--evidence",
        "{\"kind\":\"file\",\"criterion_ids\":[\"criterion-a\"],\"freshness\":\"recompute_on_check\",\"limitations\":[],\"location\":{\"repository_relative_path\":\"artifact.txt\"}}"
      ],
      "stdin_mode": "none",
      "stdin_content_file": null,
      "fixed_environment": {
        "CASE_CLOCK": "2026-09-04T03:02:01Z",
        "CASE_ID_SEED": "case",
        "CASE_PROCESS_PROFILE": "controlled-test",
        "CASE_PROCESS_PID": "1001",
        "CASE_PROCESS_STARTED_AT": "2026-09-04T03:00:00Z",
        "CASE_PROCESS_STATUS": "terminated",
        "CASE_NETWORK": "deny",
        "LANG": "C",
        "LC_ALL": "C",
        "TZ": "UTC"
      },
      "concurrency_group": null,
      "fault_point": null
    },
    {
      "actor_label": "trace-main",
      "argv": [
        "--json",
        "evidence",
        "add",
        "--dossier",
        "case-dossier-1",
        "--operation",
        "op-retry",
        "--run",
        "case-run-1",
        "--expected-revision",
        "0",
        "--expected-state-digest",
        "sha256:c8fdd08bc12368f98d3aaa736d1bc1057d07ea18aba6b549a6039021205c175d",
        "--evidence",
        "{\"kind\":\"file\",\"criterion_ids\":[\"criterion-a\"],\"freshness\":\"recompute_on_check\",\"limitations\":[],\"location\":{\"repository_relative_path\":\"artifact.txt\"}}"
      ],
      "stdin_mode": "none",
      "stdin_content_file": null,
      "fixed_environment": {
        "CASE_CLOCK": "2000-01-01T00:00:00Z",
        "CASE_ID_SEED": "later-invocation",
        "CASE_PROCESS_PROFILE": "controlled-test",
        "CASE_PROCESS_PID": "2002",
        "CASE_PROCESS_STARTED_AT": "1999-12-31T23:59:59Z",
        "CASE_PROCESS_STATUS": "terminated",
        "CASE_NETWORK": "deny",
        "LANG": "C",
        "LC_ALL": "C",
        "TZ": "UTC"
      },
      "concurrency_group": null,
      "fault_point": null
    }
  ],
  "expected": [
    {
      "process_exit": 0,
      "result_code": "CASE_OK",
      "stdout_json_file": "data/expected/generated/retry-immediate-0.json",
      "stderr": "empty",
      "stderr_file": null
    },
    {
      "process_exit": 0,
      "result_code": "CASE_OK",
      "stdout_json_file": "data/expected/generated/retry-immediate-1.json",
      "stderr": "empty",
      "stderr_file": null
    }
  ],
  "expected_final_tree": [
    {
      "path": ".case-agent/dossiers/case-dossier-1/decisions/.keep",
      "presence": "present",
      "sha256": "sha256:e3b0c44298fc1c149afbf4c8996fb92427ae41e4649b934ca495991b7852b855"
    },
    {
      "path": ".case-agent/dossiers/case-dossier-1/dossier.json",
      "presence": "present",
      "sha256": "sha256:cdde6015130c7c10decbd1270cf06b78bec5b09ea2ef99f6fa5ca4c2eee20092"
    },
    {
      "path": ".case-agent/dossiers/case-dossier-1/handoffs/.keep",
      "presence": "present",
      "sha256": "sha256:e3b0c44298fc1c149afbf4c8996fb92427ae41e4649b934ca495991b7852b855"
    },
    {
      "path": ".case-agent/dossiers/case-dossier-1/submissions/.keep",
      "presence": "present",
      "sha256": "sha256:e3b0c44298fc1c149afbf4c8996fb92427ae41e4649b934ca495991b7852b855"
    },
    {
      "path": ".case-agent/locks/.keep",
      "presence": "present",
      "sha256": "sha256:e3b0c44298fc1c149afbf4c8996fb92427ae41e4649b934ca495991b7852b855"
    },
    {
      "path": ".case-agent/manifest.json",
      "presence": "present",
      "sha256": "sha256:66f56e2f32be3eca6721a2cc533045ba637151770bcecd84b938aef76f96ba45"
    },
    {
      "path": "artifact.txt",
      "presence": "present",
      "sha256": "sha256:2d27fbdf4e8ca207afbfa388ca9172fbcc6c70e534af2476b3b704f87debadcf"
    }
  ],
  "expected_derived_view_file": null
}
