{
  "fixture_version": "1",
  "case_id": "submission-success",
  "normative_rule_ids": [
    "M0-CHECK-002",
    "M0-CHECK-010",
    "M0-CHECK-011",
    "M0-ENVELOPE-001",
    "M0-ENVELOPE-003",
    "M0-ENVELOPE-004",
    "M0-ENVELOPE-005",
    "M0-ENVELOPE-006",
    "M0-ENVELOPE-007",
    "M0-ENVELOPE-008",
    "M0-ENVELOPE-011",
    "M0-SOURCE-003",
    "M0-STATE-007",
    "M0-STATE-012",
    "M0-STATE-013"
  ],
  "applicable_platform_profiles": [
    "controlled-test"
  ],
  "initial_tree": [
    {
      "path": ".case-agent/dossiers/case-dossier-1/decisions/.keep",
      "content_file": "data/empty.bin",
      "sha256": "sha256:e3b0c44298fc1c149afbf4c8996fb92427ae41e4649b934ca495991b7852b855"
    },
    {
      "path": ".case-agent/dossiers/case-dossier-1/dossier.json",
      "content_file": "data/base-dossier.json",
      "sha256": "sha256:95c75dce56bc78d3db8c532acba516a20b8b692085a5e1b1183be0f5214eb44e"
    },
    {
      "path": ".case-agent/dossiers/case-dossier-1/handoffs/.keep",
      "content_file": "data/empty.bin",
      "sha256": "sha256:e3b0c44298fc1c149afbf4c8996fb92427ae41e4649b934ca495991b7852b855"
    },
    {
      "path": ".case-agent/dossiers/case-dossier-1/submissions/.keep",
      "content_file": "data/empty.bin",
      "sha256": "sha256:e3b0c44298fc1c149afbf4c8996fb92427ae41e4649b934ca495991b7852b855"
    },
    {
      "path": ".case-agent/locks/.keep",
      "content_file": "data/empty.bin",
      "sha256": "sha256:e3b0c44298fc1c149afbf4c8996fb92427ae41e4649b934ca495991b7852b855"
    },
    {
      "path": ".case-agent/manifest.json",
      "content_file": "data/manifest.json",
      "sha256": "sha256:66f56e2f32be3eca6721a2cc533045ba637151770bcecd84b938aef76f96ba45"
    },
    {
      "path": "artifact.txt",
      "content_file": "data/artifact-v1.txt",
      "sha256": "sha256:2d27fbdf4e8ca207afbfa388ca9172fbcc6c70e534af2476b3b704f87debadcf"
    }
  ],
  "invocations": [
    {
      "actor_label": "trace-main",
      "argv": [
        "evidence",
        "add",
        "--dossier",
        "case-dossier-1",
        "--operation",
        "op-evidence",
        "--run",
        "case-run-1",
        "--evidence",
        "{\"kind\":\"file\",\"criterion_ids\":[\"criterion-a\"],\"freshness\":\"recompute_on_check\",\"limitations\":[],\"location\":{\"repository_relative_path\":\"artifact.txt\"}}"
      ],
      "stdin_mode": "interactive_script",
      "stdin_content_file": "data/interactive/submission-success-0.json",
      "fixed_environment": {
        "CASE_CLOCK": "2026-09-04T03:02:01Z",
        "CASE_ID_SEED": "case",
        "CASE_PROCESS_PROFILE": "controlled-test",
        "CASE_PROCESS_PID": "1001",
        "CASE_PROCESS_STARTED_AT": "2026-09-04T03:00:00Z",
        "CASE_PROCESS_STATUS": "terminated",
        "CASE_NETWORK": "deny",
        "LANG": "C",
        "LC_ALL": "C",
        "TZ": "UTC"
      },
      "concurrency_group": null,
      "fault_point": null
    },
    {
      "actor_label": "trace-main",
      "argv": [
        "submission",
        "create",
        "--dossier",
        "case-dossier-1",
        "--operation",
        "op-submit",
        "--run",
        "case-run-1"
      ],
      "stdin_mode": "interactive_script",
      "stdin_content_file": "data/interactive/submission-success-1.json",
      "fixed_environment": {
        "CASE_CLOCK": "2026-09-04T03:02:01Z",
        "CASE_ID_SEED": "case",
        "CASE_PROCESS_PROFILE": "controlled-test",
        "CASE_PROCESS_PID": "1001",
        "CASE_PROCESS_STARTED_AT": "2026-09-04T03:00:00Z",
        "CASE_PROCESS_STATUS": "terminated",
        "CASE_NETWORK": "deny",
        "LANG": "C",
        "LC_ALL": "C",
        "TZ": "UTC"
      },
      "concurrency_group": null,
      "fault_point": null
    }
  ],
  "expected": [
    {
      "process_exit": 0,
      "result_code": "CASE_OK",
      "stdout_json_file": "data/expected/generated/submission-success-0.json",
      "stderr": "exact",
      "stderr_file": "data/prompts/submission-success-0-stderr.txt"
    },
    {
      "process_exit": 0,
      "result_code": "CASE_OK",
      "stdout_json_file": "data/expected/generated/submission-success-1.json",
      "stderr": "exact",
      "stderr_file": "data/prompts/submission-success-1-stderr.txt"
    }
  ],
  "expected_final_tree": [
    {
      "path": ".case-agent/dossiers/case-dossier-1/decisions/.keep",
      "presence": "present",
      "sha256": "sha256:e3b0c44298fc1c149afbf4c8996fb92427ae41e4649b934ca495991b7852b855"
    },
    {
      "path": ".case-agent/dossiers/case-dossier-1/dossier.json",
      "presence": "present",
      "sha256": "sha256:5c9e30c0178d22518b614127fcb04015150926017674a44a8db7645f53feace3"
    },
    {
      "path": ".case-agent/dossiers/case-dossier-1/handoffs/.keep",
      "presence": "present",
      "sha256": "sha256:e3b0c44298fc1c149afbf4c8996fb92427ae41e4649b934ca495991b7852b855"
    },
    {
      "path": ".case-agent/dossiers/case-dossier-1/submissions/.keep",
      "presence": "present",
      "sha256": "sha256:e3b0c44298fc1c149afbf4c8996fb92427ae41e4649b934ca495991b7852b855"
    },
    {
      "path": ".case-agent/dossiers/case-dossier-1/submissions/submission-op-submit.json",
      "presence": "present",
      "sha256": "sha256:912c3ec250de7448e5cce87cd4a91aabc7fa5ac1a46c91fb5841df682bea7a8c"
    },
    {
      "path": ".case-agent/locks/.keep",
      "presence": "present",
      "sha256": "sha256:e3b0c44298fc1c149afbf4c8996fb92427ae41e4649b934ca495991b7852b855"
    },
    {
      "path": ".case-agent/manifest.json",
      "presence": "present",
      "sha256": "sha256:66f56e2f32be3eca6721a2cc533045ba637151770bcecd84b938aef76f96ba45"
    },
    {
      "path": "artifact.txt",
      "presence": "present",
      "sha256": "sha256:2d27fbdf4e8ca207afbfa388ca9172fbcc6c70e534af2476b3b704f87debadcf"
    }
  ],
  "expected_derived_view_file": null
}
