{
  "fixture_version": "1",
  "case_id": "material-brief-new-dossier",
  "normative_rule_ids": [
    "M0-SCALAR-011",
    "M0-STATUS-011"
  ],
  "applicable_platform_profiles": [
    "controlled-test"
  ],
  "initial_tree": [
    {
      "path": ".case-agent/dossiers/.keep",
      "content_file": "data/empty.bin",
      "sha256": "sha256:e3b0c44298fc1c149afbf4c8996fb92427ae41e4649b934ca495991b7852b855"
    },
    {
      "path": ".case-agent/locks/.keep",
      "content_file": "data/empty.bin",
      "sha256": "sha256:e3b0c44298fc1c149afbf4c8996fb92427ae41e4649b934ca495991b7852b855"
    },
    {
      "path": ".case-agent/manifest.json",
      "content_file": "data/manifest.json",
      "sha256": "sha256:66f56e2f32be3eca6721a2cc533045ba637151770bcecd84b938aef76f96ba45"
    }
  ],
  "invocations": [
    {
      "actor_label": "trace-main",
      "argv": [
        "--json",
        "dossier",
        "create",
        "--operation",
        "op-brief-a",
        "--actor",
        "actor-a",
        "--title",
        "First governed objective",
        "--objective",
        "Objective A",
        "--brief",
        "{\"scope\":{\"in\":[\"artifact.txt\"],\"out\":[\"deployment\"]},\"constraints\":[\"local-only\"],\"acceptance_criteria\":[{\"criterion_id\":\"criterion-a\",\"statement\":\"Artifact digest matches\",\"verification\":\"mechanical\"}]}"
      ],
      "stdin_mode": "none",
      "stdin_content_file": null,
      "fixed_environment": {
        "CASE_CLOCK": "2026-09-04T03:02:01Z",
        "CASE_ID_SEED": "case",
        "CASE_PROCESS_PROFILE": "controlled-test",
        "CASE_PROCESS_PID": "1001",
        "CASE_PROCESS_STARTED_AT": "2026-09-04T03:00:00Z",
        "CASE_PROCESS_STATUS": "terminated",
        "CASE_NETWORK": "deny",
        "LANG": "C",
        "LC_ALL": "C",
        "TZ": "UTC"
      },
      "concurrency_group": null,
      "fault_point": null
    },
    {
      "actor_label": "trace-main",
      "argv": [
        "--json",
        "dossier",
        "create",
        "--operation",
        "op-brief-b",
        "--actor",
        "actor-a",
        "--title",
        "Replacement governed objective",
        "--objective",
        "Objective B",
        "--brief",
        "{\"scope\":{\"in\":[\"artifact.txt\"],\"out\":[\"deployment\"]},\"constraints\":[\"local-only\"],\"acceptance_criteria\":[{\"criterion_id\":\"criterion-a\",\"statement\":\"Artifact digest matches\",\"verification\":\"mechanical\"}]}"
      ],
      "stdin_mode": "none",
      "stdin_content_file": null,
      "fixed_environment": {
        "CASE_CLOCK": "2026-09-04T03:02:01Z",
        "CASE_ID_SEED": "case",
        "CASE_PROCESS_PROFILE": "controlled-test",
        "CASE_PROCESS_PID": "1001",
        "CASE_PROCESS_STARTED_AT": "2026-09-04T03:00:00Z",
        "CASE_PROCESS_STATUS": "terminated",
        "CASE_NETWORK": "deny",
        "LANG": "C",
        "LC_ALL": "C",
        "TZ": "UTC"
      },
      "concurrency_group": null,
      "fault_point": null
    }
  ],
  "expected": [
    {
      "process_exit": 0,
      "result_code": "CASE_OK",
      "stdout_json_file": "data/expected/generated/material-brief-new-dossier-0.json",
      "stderr": "empty",
      "stderr_file": null
    },
    {
      "process_exit": 0,
      "result_code": "CASE_OK",
      "stdout_json_file": "data/expected/generated/material-brief-new-dossier-1.json",
      "stderr": "empty",
      "stderr_file": null
    }
  ],
  "expected_final_tree": [
    {
      "path": ".case-agent/dossiers/.keep",
      "presence": "present",
      "sha256": "sha256:e3b0c44298fc1c149afbf4c8996fb92427ae41e4649b934ca495991b7852b855"
    },
    {
      "path": ".case-agent/dossiers/case-dossier-1/dossier.json",
      "presence": "present",
      "sha256": "sha256:2951f71f4640cb04eb306420239b2290ecd32496002c2a32bffd3c83f4941f3d"
    },
    {
      "path": ".case-agent/dossiers/case-dossier-2/dossier.json",
      "presence": "present",
      "sha256": "sha256:ef783c60f11f2ede5f0d9a7aab0f84ece4be10353712a5bb08877d72b2cad6de"
    },
    {
      "path": ".case-agent/locks/.keep",
      "presence": "present",
      "sha256": "sha256:e3b0c44298fc1c149afbf4c8996fb92427ae41e4649b934ca495991b7852b855"
    },
    {
      "path": ".case-agent/manifest.json",
      "presence": "present",
      "sha256": "sha256:66f56e2f32be3eca6721a2cc533045ba637151770bcecd84b938aef76f96ba45"
    }
  ],
  "expected_derived_view_file": null
}
