{
  "fixture_version": "1",
  "case_id": "projections-positive",
  "normative_rule_ids": [
    "M0-PROJECTION-001",
    "M0-PROJECTION-002",
    "M0-PROJECTION-003",
    "M0-PROJECTION-004",
    "M0-PROJECTION-005",
    "M0-PROJECTION-006",
    "M0-PROJECTION-008",
    "M0-PROJECTION-009",
    "M0-PROJECTION-010",
    "M0-PROJECTION-011",
    "M0-PROJECTION-012",
    "M0-PROJECTION-013",
    "M0-PROJECTION-014",
    "M0-PROJECTION-015",
    "M0-PROJECTION-016",
    "M0-PROJECTION-017",
    "M0-PROJECTION-018",
    "M0-PROJECTION-019",
    "M0-PROJECTION-020",
    "M0-STATE-006",
    "M0-STATE-010",
    "M0-STATE-011",
    "M0-STATE-018",
    "M0-STATE-019"
  ],
  "applicable_platform_profiles": [
    "controlled-test"
  ],
  "initial_tree": [],
  "invocations": [
    {
      "actor_label": "trace-probe",
      "argv": [
        "@probe",
        "projections-positive"
      ],
      "stdin_mode": "none",
      "stdin_content_file": null,
      "fixed_environment": {
        "CASE_CLOCK": "2026-09-04T03:02:01Z",
        "CASE_ID_SEED": "probe",
        "CASE_PROCESS_PROFILE": "controlled-test",
        "CASE_PROCESS_PID": "1001",
        "CASE_PROCESS_STARTED_AT": "2026-09-04T03:00:00Z",
        "CASE_PROCESS_STATUS": "terminated",
        "CASE_NETWORK": "deny",
        "LANG": "C",
        "LC_ALL": "C",
        "TZ": "UTC"
      },
      "concurrency_group": null,
      "fault_point": null
    }
  ],
  "expected": [
    {
      "process_exit": 0,
      "result_code": "CASE_OK",
      "stdout_json_file": "data/expected/probe-ok.json",
      "stderr": "empty",
      "stderr_file": null
    }
  ],
  "expected_final_tree": [],
  "expected_derived_view_file": null
}
